,corpus,have_transition_plan
0,selected datahas independently assured 2007 (see earlier reports).,True
1,certain key data independently assured (see below).,True
2,we engaged dnv perform independent limited assurance selection material 2022 data.,True
3,"overview independent limited assurance report board directors the british land company plc the british land company plc (british land) commissioned dnv business assurance services uk limited (dnv, we) conduct limited assurance engagement selected information presented sustainability accounts 2022 (the report) reporting year ended 31 march 2022.",True
4,"this conclusion relates selected information, read context independent limited assurance report, particular inherent limitations explained overleaf.",True
5,dnv expressly disclaims liability co-responsibility decision person entity based independent limited assurance report.,True
6,"our responsibility plan perform work obtain limited assurance selected information prepared accordance criteria report british land form independent limited assurance conclusion, based work performed evidence obtained.",True
7,"our esg journey our 2030 commitments performance overview (kpis) net zero carbon place based approach responsible business performance data 2022 epra index sasb index reporting criteria assurance reports 2 3 4 5 9 17 24 27 61 64 66 85 read tcfd disclosures 2022 annual report against challenging backdrop, teams fantastic job year, working customers partners support local communities.",False
8,"as new year, new uncertainties horizon, dedication vital ever.",False
9,"introduction this year celebrate 20 years sustainability reporting, environmental social focus integral way business.",False
10,the climate emergency high everyones agenda; face cost living crisis impact covid 19 continues reverberate communities.,False
11,this means progressing pathway net zero making positive impact places important ever.,False
12,we continued deliver strong progress year.,False
13,"at 1 triton square, completed second net zero carbon development site canada water, piloting innovative building materials technologies deliver market leading, highly sustainable buildings.",False
14,"our approach right terms environment, reflects customers increasingly expect.",False
15,"the strong business case sustainable buildings underlined year leasing success 1 broadgate, sustainable buildings london fully let (or option) years ahead completion.",False
16,"on standing portfolio, completed net zero audits working customers invest energy efficient interventions programme identified.",False
17,one outcome raise epc ratings portfolio a b 2030 line expected mees legislation.,False
18,"we delighted efforts recognised gresb, global real estate sustainability benchmark achieved 5* rating developments standing investments.",False
19,"on social side, place based approach strong local relationships allow adapt emerging needs opportunities place biggest impact.",False
20,"this year community activities benefitted nearly 24,000 people.",False
21,"our lasting collaboration capital city partnership fort kinnaird, help people face barriers employment, powerful example (see p23).",False
22,this year marked years partnership national literacy trust.,False
23,"against challenging backdrop, teams fantastic job, working customers partners support local communities.",False
24,i like thank hard work huge contribution making places vibrant successful.,False
25,"as new year, new uncertainties, dedication vital ever.",False
26,"overview overview broadgate places people prefer our purpose create manage outstanding places deliver positive outcomes stakeholders long term, sustainable basis.",False
27,we understanding evolving needs ofthe people organisations use places communities live them.,False
28,"the deep connections created customers, communities, partners people important emerge pandemic.",False
29,second net zero carbon development completed embodied carbon 1 triton square 2030 target 436 co2e sqm offset certified schemes including teak afforestation project mexico community reforestation project ghana.,False
30,"net zero asset audits completed working party experts, completed 29 audits portfolio identifying opportunities improve energy efficiency standing portfolio.",False
31,"awarded bre4 innovation credits for heat exchange system, recycling waste heat offices residential canada water introducing materials passport, facilitating materials re-use 1 broadgate.",False
32,"offices development pipeline, including completed developments 2.",False
33,whole building operational energy intensity improvement vs 2019 baseline offices 3.,False
34,impacted covid-19 restrictions requiring assets close operate lower capacity 4.,False
35,"building research establishment, parent organisation breeam certification framework launched ndt broadgate together new diorama theatre launched ndt broadgate support recovery arts post-pandemic.",False
36,one londons biggest rehearsal artist development complexes.,False
37,this year celebrate 20 years sustainability reporting environmental social focus integral business.,False
38,launched sustainability brief developments.,False
39,founding member uk green building council.,False
40,launched community investment fund.,False
41,signatory un global compact.,False
42,delivered breeam excellent projects.,False
43,introduced smart energy management system.,False
44,completed life carbon assessments.,False
45,our sustainability brief established social environmental requirements developments.,False
46,the ukgbc works promote sustainability built environment.,False
47,"supported 56,000 children read partnership national literacy trust began.",False
48,"launched community charter, laying foundation todays local charter.",False
49,started young readers programme partnership.,False
50,"queens award lasting economic, social environmental achievements launched regents place customer community fund industry first.",False
51,"launched bright lights, skills employment programme.",False
52,worked happy city establish seven core principles guide placemaking activities.,False
53,launched 2030 sustainability strategy commitment net zero 2030.,False
54,introduced internal carbon levy 60 tonne embodied carbon developments.,False
55,launched transition vehicle fund energy efficient improvements.,False
56,our bright lights skills employment programme science based targets initiative validated carbon reduction targets.,False
57,our net zero pathway* sets ways reduce carbon emissions.,False
58,we offset embodied carbon developments 2030 offset operational carbon.,False
59,overview overview our 2030 commitments net zero carbon environmental leadership place based approach we committed achieving net zero carbon portfolio 2030 set clear targets reduce embodied carbon developments operational carbon portfolio.,False
60,we demonstrate strong progress delivering participating leading international benchmarks.,False
61,our target achieve 5* gresb rating 2022 pleased achieved years ahead target.,False
62,top 81st percentile science based targets: approval 2021 our place based approach means understanding important issues opportunities communities places focusing efforts collaboratively biggest impact place.,False
63,"to deliver this, work directly community partners collaborate customers identify key local issues impact.",False
64,"connect: connecting customers, suppliers community partners priority local issues opportunities.",False
65,"our community funds broadgate, paddington regents place example approach education: needs-based initiatives places working long term partner national literacy trust employment: needs-based initiatives places.",False
66,"recent focus supporting impacted covid 19, example virtual employment training supporting local business: supporting local business provision affordable workspace, thrive canada water wellbeing: putting wellbeing principles practice, year included new park exchange square, broadgate.",False
67,responsible business we advocate responsible business practices british land supply chain.,False
68,our key areas focus set below.,False
69,"proportion units epcs rated a b assets under management 2030 target 5-star 2022 100% 50% 2025 5% reduction operational water consumption vs 2020 operational waste managed assets re-used, composted, recycled development operational waste diverted landfill new construction major renovation projects designed achieve 10% net gain biodiversity % managed assets biodiversity action plans % managed assets major developments undergone flood risk assessment 5% offices: 80% retail: 70% 100% 100% 100% 1.",False
70,"from 2021, 2030 strategy upgraded breeam targets outstanding offices (from excellent) excellent retail (from very good) 2.",False
71,"excludes residential fy22 performance 5-star 70% 44% 28% 36% 13% offices: 76% retail: 48% 96% on track 15% 100% 2021 5-star 73% 27% 25% 24% 20% 71% 47% 100% nr 18% 100% 2020 4-star 24% 21% 25% 72% 54% 99% nr nr 100% breeam certifications to date, pursued breeam certificates 44% standing portfolio.",False
72,"while target best-in-class certifications new developments major refurbishments, majority portfolio built prior bre certification schemes route certifying assets operational certifications, primarily breeam in use.",False
73,we currently pursuing multi-stage rollout breeam in use certifications including first-time pilots retail assets.,False
74,"likewise, committed near term developments complete, entry standing portfolio increase proportion highly-rated assets.",False
75,"following socio-economic assessments, business plans created sites fy23 priorities report social value generated develop social value target 5 year target to reported fy23 place based initiatives identified priority assets.",False
76,we use priority assets tables pages 21-23 report progress this.,False
77,overview net zero carbon net zero carbon we committed achieving net zero carbon portfolio 2030 set clear targets reduce embodied carbon developments operational carbon portfolio.,False
78,we long track record delivering sustainable space clear competitive advantage business customers prioritise sustainability.,False
79,overview net zero carbon net zero delivering pathway last year set pathway net zero.,False
80,we delivered commitments year advanced coming year.,False
81,"overview net zero carbon blossom yard & studios, norton folgate net zero carbon reducing embodied carbon developments to progress target 500 co2e sqm embodied carbon office developments 2030, committed undertaking life carbon assessments developments major refurbishments.",False
82,"to this, adopted one click lca life cycle assessment software developments.",False
83,"this enables consolidate data consultants, benchmark performance monitor progress.",False
84,"this helping identify designs, materials techniques generate significant carbon savings.",False
85,norton folgate case study we focus reusing existing materials structures far possible.,False
86,"at blossom studios, buildings norton folgate development retained existing faade 80% floors, timber joists individually assessed re-used.",False
87,we rebuilt internal walls re-using reclaimed bricks original building retained original features iron columns glazed bricks preserve original character building.,False
88,new materials focused responsibly sourced low carbon alternatives; 100% fsc (forest stewardship council) wood concrete 40% cement replacement.,False
89,"as result currently expect embodied carbon 403 co2e sqm (434 co2e sqm redevelopment), ahead 2030 target.",False
90,"to drive operational performance adding roof solar panels air source heat pumps deliver electric offices 100% green power, operational energy intensity expected line trajectory 2030.",False
91,"overview net zero carbon reducing embodied carbon developments continued canada water case study unlike norton folgate, greater capacity reuse existing materials, canada water ground redevelopment.",False
92,"this means minimise embodied carbon emissions, focus piloting sustainable materials processes.",False
93,"at a1, mixed use building includes 186 residential units 120,000 sq ft workspace, sustainable materials superstructure.",False
94,"this includes ggbs (ground granulated blast-furnace slag), waste product blast furnaces iron repurposed cement replacement.",False
95,"we post tensioned concrete slabs stronger thinner, requiring concrete, cross laminated timber reducing number steel beams required electric arc furnace steel.",False
96,these innovations line commitment pilot low carbon materials net zero pathway.,False
97,"our current projections embodied carbon 682 co2e sqm 2030 target 500kg co2e sqm, glidepath 2030.",False
98,well gold certifications targeted outdoor space offsetting strategy we prioritise re-use existing materials minimise embodied carbon far possible.,False
99,"where residual embodied carbon avoided design material choice, offset certified emission reduction projects.",False
100,"we use nature based offset credits possible, select projects support biodiversity economic benefits local communities.",False
101,"project works closely local farmers, employed project able grow crops.",False
102,"aim expand 1,000 hectares year.",False
103,"supporting planting 23,000 trees woodland carbon code.",False
104,this additional commitment formal offset 1 triton square.,False
105,overview net zero carbon reducing operational carbon the chart sets key opportunities reduce carbon emissions portfolio coming years.,False
106,on standing portfolio focus renewable power energy saving initiatives buildings.,False
107,"renewable power (grid, onsite offsite) residual emissons offset 2030 2030 energy saving initiatives new developments present greatest opportunity deliver best class buildings operationally, highly energy efficient.",False
108,"the chart illustrates improvement 1 broadgate, energy intensity sixth previous building.",False
109,"relatively recent developments, 4 kingdom street, efficient portfolio thoughtful asset management deliver significant improvement relatively low cost.",False
110,"in case, key intervention heat pump accounting 70% retrofit cost, altogether represents 1% buildings value.",False
111,older buildings broadgate tower require comprehensive retrofitting.,False
112,this year completed 29 net zero audits buildings portfolio identifying initiatives deliver 25% improvement building energy efficiency.,False
113,a case study exchange house shown page.,False
114,"indicative view assumes developments built development pipeline excludes capital activity we offset residual embodied carbon developments 2030, offset operational carbon standing portfolio seek minimise far possible following ways.",False
115,the decarbonisation national grid play key role switch renewable power uk.,False
116,we supplement investing onsite offsite renewable energy sources.,False
117,already 2 mega watts capacity portfolio (of half meadowhall) undertaking feasibility studies identify opportunities rooftop solar car port possibilities.,False
118,detailed studies underway retail sites car park meadowhall shopping centre.,False
119,we exploring opportunities offsite renewables increase relative contribution renewable power overall pathway.,False
120,"overview net zero carbon reducing operational carbon continued increasing energy efficiency standing portfolio this year, party consultants completed net zero audits covering 29 major assets.",False
121,"these identified initiatives standing portfolio, actioned deliver 25% improvement building energy efficiency line target.",False
122,"some initiatives delivered, reducing energy use 23% saving occupiers 340,000 annually.",False
123,one effective interventions delivered introducing co2 controls; sensors installed office floors enabling monitor fresh air levels adjust ventilation needed.,False
124,this relatively low cost measure significantly cut demand heating cooling.,False
125,"we installing dedicated chillers hours cooling, reducing requirement run main chillers intensive.",False
126,the significant interventions led lighting heat pumps.,False
127,the improvements deliver savings payback investment 5 years expect two-thirds cost funded service charge covered directly occupiers.,False
128,"these interventions improve buildings epc rating b e, making building fully compliant expected mees legislation.",False
129,overview place based approach our place based approach a place based approach means understanding important issues opportunities communities places focusing efforts collaboratively biggest impact.,False
130,"overview place based approach place based approach social impact we invest directly local community organisations, support range ways, including use space work occupiers deliver positive social impact areas focus.",False
131,"our local charter focuses key areas create lasting positive legacy work, shop live places.",False
132,"connect we connect local communities bringing customers, suppliers community partners common goal place.",False
133,connecting customers community partners strongest social contributions.,False
134,"following success regents place community fund, year worked customers launch funds broadgate paddington central.",False
135,"together, agree priority local themes, pledge funds award grants community organisations working locally.",False
136,"in year, 15 customers local stakeholders pledged 150,000 broadgate paddington central community funds.",False
137,"we support educational initiatives local people helping discover potential, developing skills raising awareness career opportunities sectors.",False
138,"this year, delivered 58 education initiatives.",False
139,these ranged primary school projects secondary school workshops college events university challenges.,False
140,"we continued partnership national literacy trust 29 places, working collaboratively customers local schools encourage additional 7,800 children read pleasure improve literacy skills.",False
141,"together, reached 56,000 children partnership began.",False
142,"employment we support local training jobs bright lights, skills employment programme, working customers, suppliers local partners.",False
143,"recognising impact covid-19 emerging cost living crisis, refocused bright lights support affected, including individuals lost livelihoods.",False
144,these initiatives run portfolio.,False
145,we reached 135 people virtual employment training one-to-one support designed local residents skills achieve lasting employment.,False
146,the programme included ringfenced opportunities businesses places.,False
147,"on average 60% candidates gained employment, range sectors glasgow fort rises 75%.",False
148,"supporting local business = affordable space we support local businesses opening opportunities local independents, social enterprises start-ups support future success.",False
149,we provided affordable space priority assets identified opportunities remaining three.,False
150,"this includes affordable work space, affordable retail space community arts space.",False
151,"following success new diorama theatre (ndt) regents place, launched ndt broadgate support recovery arts post-pandemic.",False
152,"the project kind world, ndt broadgate attracted footfall 80,000 creatives, engaged 600,000 people supported creation highly successful productions.",False
153,new diorama theatre regents place won the stages fringe theatre year 2022 award.,False
154,"we create places support health wellbeing customers, colleagues communities.",False
155,"we develop partnerships communities support wellbeing people work, visit live places.",False
156,"in 2022 range wellbeing initiatives, community partners darnall united global generation, supported 2,700 beneficiaries.",False
157,"we track achieve well platinum, 1 broadgate, highest level certification globally-recognised benchmark health wellbeing.",False
158,"working closely occupier jll architect ahmm, targeting industry leading standards air quality, water light.",False
159,we continue align developments well standard.,False
160,"our office developments canada water, a1 a2, well-ready.",False
161,this pre-certification supports delivering outstanding workspaces customers opens opportunity customers partner pursuing well certification employee health wellbeing.,False
162,our social reporting subsequent pages focuses priority assets details specific activities 2022 commitments 2023.,False
163,"however, place based approach goes far assets programmes delivered portfolio.",False
164,"the reach biggest community initiatives, partnership the national literacy trust bright lights employment initiative seen map.",False
165,"supporting ukraine to support affected war ukraine donated 25,000 disaster emergency committee included matching personal donations people.",False
166,"we donated 5,000 ukrainian cathedral marylebone, close head office.",False
167,"at paddington central, pledged 30,000 funding scheme support ukrainian institute setting english language school refugees donated space host classrooms storey club.",False
168,"at number assets, rolled specific qr codes enable people donations british red cross easily.",False
169,cost living crisis during fy23 collaborating long term partners support excellent work help struggling cost living crisis.,False
170,our bright lights initiatives focus activities affected.,False
171,"overview place based approach delivering place based working local partners, focusing core theme asset, biggest social impact.",False
172,we appreciate respect british land do.,False
173,"they long term vision that, like weve brought subsoil wonderful conversation place comes together.",False
174,"jane riddiford, global generation canada water at canada water, partnership environmental education charity global generation continues grow.",False
175,"this year, global generation engaged 600 local primary schoolchildren workshops worked generator youth leaders.",False
176,"constructed circular economy principles, new facility provide fantastic community resource years come.",False
177,"paddington central at paddington central, connecting customers local partners inclusive opportunities year launched new community fund collaboration occupiers partner address key local issues.",False
178,"in april 2021, unveiled community garden, supported occupiers wipro kingfisher.",False
179,"local schoolchildren visitors garden year, customers volunteered 300 people took workshops gardening food growing urban farming experts, square mile farms.",False
180,"customers volunteered 60 hours help adults learning disabilities run fruit smoothie stall campus, partnership local non-profit pursuing independent paths.",False
181,"representatives businesses campus continue connect diversity inclusion network, activities year including session activist, ted speaker author nova reid mark black history month.",False
182,"overview place based approach our place based approach action education supporting local business = affordable space wellbeing broadgate at broadgate, partnering open access educational opportunities age spectrum primary school university.",False
183,"this year alone, engaged 47 schoolchildren local broadgate collaboration national literacy trust customers.",False
184,a 9 local students completed virtual work experience programme.,False
185,"our partnership university east london continued grow, students worked collaboratively designs campus broadgate prize.",False
186,"canada water at canada water, continue partner tree shepherd deliver thrive, affordable workspace business support entrepreneurs, prioritising se16 residents.",False
187,"through project, aim create self-sustaining local business network, growing pipeline successful enterprises future opportunities canada water.",False
188,"this year, supported 72 entrepreneurs business advice gone set businesses self-employed.",False
189,"we provided low-cost workspace, including offices, meeting rooms makerspace.",False
190,british land authentically supports people community.,False
191,"together, working create place local people run businesses supported successful.",False
192,its people place meaningful.,False
193,"sandra ferguson, tree shepherd regents place at regents place, providing 10,000 sq ft affordable workspace 1 triton square donated space triton caf community uses.",False
194,this included meeting space local non-profit camden giving occupier new diorama theatre.,False
195,"we provided space blackout uk run monthly events months supported peer learning, debates, networking meaningful connections 75 black queer men.",False
196,"there tens thousands plants, including native species flowering varieties good bees, butterflies insects.",False
197,mature birch trees offer homes birds.,False
198,"this enhance biodiversity open access nature, studies boosts wellbeing productivity.",False
199,"the park valuable community space, designed accessibility.",False
200,"we host events customers local people, including talks gardening led head gardener.",False
201,"to help create network green spaces wildlife central london, working roof gardens exchange house nearby 1 appold street.",False
202,"what nature loves things mixture change, thats mirrored environments planting exchange square.",False
203,british land exceptionally supportive taking different approach urban planting.,False
204,the reason recruitment skills partnership works theres real family feel fort kinnaird.,False
205,"at fort kinnaird, strong relationship capital city partnership enabled respond rapidly retailers communities faced shifts covid sudden recruitment needs.",False
206,"together, supported nearly 90 people jobs year delivered employability sessions 130 young people.",False
