,corpus,have_transition_plan
657,"on-site renewables retail includes photovoltaic panels whiteley, serpentine, st stephens, old market, drake circus leisure meadowhall.",False
658,energy generated st stephens serpentine green consumed site (common parts energy use) exported grid.,False
659,energy generated whiteley old market exported grid.,False
660,"for purpose greenhouse gas emissions calculations, assumed electricity generated retail sites exported grid.",False
661,proportion purchased electricity renewable sources calculated total renewable electricity purchased divided total purchased electricity.,False
662,proportion total electricity renewable sources calculated self-generated renewable electricity plus total renewable electricity purchased divided total electricity consumption.,False
663,the gross calorific value fuel conversions kwh.,False
664,"from 2019/20, included energy consumption flexible workspace offices (storey) reporting.",False
665,"generation relates electricity heat produced site, renewable and/or low carbon sources.",False
666,overview environmental leadership building certifications fig.,False
667,"where occurs, acceptableto default higher rating.",False
668,"where multiple sustainability certifications held building, following procedure applied determining certification reported.",False
669,"as development certificates (related buildings construction, refurbishment fit-out) significant undertakings certificates expire redevelopment space, default selection reporting development certification.",False
670,"however, operational certification sought purpose improving existing development rating, permitted substitute new operational rating place previous development certificates rating.",False
671,"however, operational certifications differ development certifications fronts, certifications seen complementing (rather replacing) other.",False
672,the code sustainable homes withdrawn march 2015 new developments.,False
673,all current certificates valid.,False
674,this certification requirement requested existing planning consents.,False
675,"from 2019, reporting residential developments track achieve bre home quality mark.",False
676,developments: developments hold pre-assessed ratings certificates achieved design stage; provided certified assessors.,False
677,"it possible development scores change final certification, occurs post completion.",False
678,final building certifications reported provided certified assessors official final certificate reported assetssection.,False
679,we aim achieve date version breeam appropriate development.,False
680,"we target breeam outstanding offices, excellent retail home quality mark 3* residential.",False
681,"we target leisure, canada water meeting local authoritys target rating.",False
682,"assets: existing portfolio hold breeam design stage, completion (final), in use 2016 major developments hold breeam completion in-use certification.",False
683,this table uses floor areas british land financial reporting.,False
684,"accordingly, annual updates adjustments undertaken intent align financial reporting.",False
685,these floor areas sourced property valuations.,False
686,"in general, offices shopping centres floor areas represent net internal area (nia), retail parks floor areas represent gross internal area (gia).",False
687,in 2021 floor areas primarily sourced mid-year valuation reports.,False
688,"existence zero values: asset exceptionally small valuation british land holds freehold reported zero floor area financial reporting, mirrored sustainability reporting.",False
689,"sustainability-linked revolving credit facility kpis: in 2020, british land completed sustainability-linked revolving credit facility incentivise coverage quality sustainability ratings portfolio.",False
690,the facility includes adjustment payable based british lands annual performance relative agreed sustainability kpis.,False
691,"the sustainability kpis (i) percentage development projects track achieve breeam excellent above, (ii) percentage assets management breeam certificate very good above.",False
692,"these kpis use data sets developments assets sections, residential properties excluded scope.",False
693,fig.,False
694,scope: includes units properties rated a-g classified missing.,False
695,assets missing epcs currently epc lodged require epc.,False
696,assets currently development included scope.,False
697,assets planned development currently managed portfolio included scope.,False
698,assets require epc lodged excluded scope.,False
699,"sectors: office sector includes offices, small retail assets.",False
700,ground floor retail units office buildings campuses included.,False
701,the office sector includes life sciences.,False
702,retail sector includes retail leisure assets logistics assets.,False
703,it includes small number offices located retail property.,False
704,whole portfolio includes office retail sectors outlined residential asset epc required.,False
705,assets going development: these assets publicly announced future developments.,False
706,overview water use fig.,False
707,"in offices, report building use, insufficient sub-metering otherwise.",False
708,"in retail residential, report common parts use.",False
709,"note: mains water refers municipal water epra guidance, borehole water ground water, on-site harvesting rainwater harvesting.",False
710,"where asset water data partially unavailable, data adjacent periods estimate data missing periods.",False
711,borehole water relates use common parts meadowhall.,False
712,some borehole water backwash cleaning filters associated borehole plant.,False
713,this water reported.,False
714,waste materials fig.,False
715,occupier waste managed reported.,False
716,"waste sent material recovery facility (mrf) included recycling, incineration and/or landfill figures.",False
717,"mrf output calculated site level, monthly, based facilitys average performance.",False
718,"waste data estimated sites march 2022, data previous period site team operational knowledge.",False
719,"from fy22 waste data captured sites split excavation, demolition construction, hazardous non hazardous categories.",False
720,re-use recycling site refer waste generated re-used recycled location.,False
721,we longer reporting waste re-use site define materials use project waste.,False
722,landfill tax costs indicative only.,False
723,"see waste data estimated sites march2022, data previous period site team operational knowledge.",False
724,fig.,False
725,overview physical risks fig.,False
726,significant incidents involve party help solve mitigate problem reported relevant local authority environment agency.,False
727,the proportion iso coverage major developments managed portfolio.,False
728,major developments our iso certification covers provision development projects construction value 5m (where 50%) design construction handover (riba stages 0 6).,False
729,extreme weather (flood risk) metrics cover assets management high flood risk defined assets located areas withaflood frequency 100 year return period.,False
730,"floodrisk assessed expert analysis undertaken willis towers watson, included theuse flood riskdata munich re nathan, jbaand cmip5.",False
731,exposure incorporates consideration oflocal flood defences.,False
732,the proportion high flood risk assets flood risk management plans calculated proportion asset value.,False
733,resource efficiency metrics sourced figs.,False
734,energy sources metrics sourced figs.,False
735,portfolio green building ratings sourced fig.,False
736,proportion gross rental income (gri) breeam certified assets ratio gri derived assets breeam certification total gri.,False
737,biodiversity fig.,False
738,"information based formal ecologists reports design team commitments, applicable.",False
739,reporting new construction major renovation projects designed achieve 10% net gain biodiversity removed fig.,False
740,there risk double counting net improvements 10% net gain indicators reported against.,False
741,"the sustainability brief review fy23 new, appropriate, reporting metrics included sustainability accounts fy23 result.",False
742,"a site specific biodiversity action plan guiding document sets british land protect, seek enhance, biodiversity sites.",False
743,"community engagement proportion assets (floorarea)where community activity implementedis reported line epra guidance, percentage total floor space (for alldirectly managedassets, excluding developments).",False
744,initiatives defined activity supports strategic community investment programme.,False
745,"they tend ongoing, scalable and/or repeated, include pilot initiatives.",False
746,"if initiative run multiple sites, counted site.",False
747,"initiatives reported outcomes initiative achieved reporting year, following criteria set fig.",False
748,excluded initiatives figures one-off ad hoc activities.,False
749,"if series programme related activity took place group offices site, initiative counted site.",False
750,"further details here: sustainability/society/bright-lights initiatives include: those initiatives run places, broadgate connect partnership capital city partnership fort kinnaird.",False
751,"ourapprenticeship programme,which counted initiative, covering: apprenticeships british landat places local communities.",False
752,"overview apprenticeshipsdriven construction suppliers property teams, includingapprentices working off-site manufacturing developments.",False
753,apprenticeships group offices.,False
754,people graduate schemes internships group offices.,False
755,also included initiatives primary focus route employment employment education outcomes recorded.,False
756,peoplereceiving employment related support training we definepeople receiving employment related support training people received meaningful supportvia programmes.,False
757,dataincludesanybeneficiaries benefitedfrom supportbut completed programme.,False
758,"people supported employment we define supported employment aspeople paid employment orapprenticeshipsas direct result ofour involvement and/or funding throughbright lights,ourapproach toskills employment.",False
759,dataforpeoplesupported employmentis subset ofdata people receiving employmentrelated support training.,False
760,people receive employment related support training progress jobs bright lights programme.,False
761,data excludesbeneficiaries progress excludes people progress jobs throughjobs fairs places.,False
762,fy20 fy19 figures beenredistributed inthe new table format remain same.,False
763,this figure includes beneficiaries activity classed initiative.,False
764,"our education programme covers activity learning outcomes forthose full-time, higher education.",False
765,"it includes sharing expertise, mentoring staff non-profit organisations job-related training provided teachers participating projects.",False
766,cashcontributionsexcludevat.,False
767,british land employee time (direct): permanent employees fixed term contractors paid covers time contributed paid working hours.,False
768,"in-kind contributions: donations space equipment owned british land,based cost commercial value.",False
769,"this covers wages salaries, social security costs, pension costs, equity-settled share-based payments elements benefits package payroll.",False
770,"separate average hourly costs calculated executive directors applied accordingly, excluding share incentive costs.",False
771,"from 2018,time input employees british lands property management arm (formerly broadgate estates ltd) basedat retail officeassetsand based group officesis valued according average cost provided includes salary, pension, healthcare, bonus car allowance.",False
772,"separate values attributed retail office property management methodology 2017, page48of our2017 sustainability accounts.",False
773,"supplier time (other) retail office assets time input developments arevalued according latest office national statistics uk average earnings data,witha 10% allowance employers national insurance 5% pension contributions.",False
774,"direct beneficiary numbers provided charity partner, community organisation community broker leading activity.",False
775,we estimate data reasonable basis so.,False
776,"leveraged cash investment:funds raised sites byour employees,fundingfrom ourjoint venture partnersoroccupiers,at ourplacestowardsactivities fully led british land(such ourcampuscommunity funds),and external funding leveraged direct result contributions.",False
777,key supplier workforce time (leveraged): supplier time working hoursandbritish land employee time outside working hours directly supports communityinvestment programme.,False
778,total individuals directly benefitting community investment programme look measure thereachof community investment programme recording number ofuniqueindividualsthatdirectly benefited support reporting covers thosethatreceiveddirectbenefit below: activityfunded british land.,False
779,"overview we report beneficiary numbers appropriatebasis so,or direct beneficiaries accurately measured.",False
780,"examples include general donations(including ourcovidcommunity response fund),contributions tocore funding,visitors local eventsthat arefully funded british land.",False
781,"if fund activity, weonlyreport number beneficiaries thatare proportionateto contribution.",False
782,"however, log 100% direct beneficiaries if: the activity fully led british land and/or site teams 50% cost provided joint venture partner.",False
783,the activity fully led british land and/or site teams thecommunitypartner accessed 50% cost sources.,False
784,"if british landemployeesorsupplierpartners support session/workshop volunteers organisationsareinvolved, record total number beneficiaries attending,where isdeemedreasonable so.",False
785,total community initiatives fy21 94.,False
786,"this includes initiatives employment, training education focused.",False
787,we commissionedplace based reviewsacross 25 places.,False
788,"these aresocio economic impact assessmentswith local insights deepen understanding social economic issues, local positivesand characteristicsof places.",False
789,"these reports provide baseline data deprivation, population employment reviewedat intervals coming years, 5years.",False
790,long term space donation: the value long term space provided community organisations outside scope b4si methodology.,False
791,in cases rent paid significantly reduced value difference market value rent paid reported community benefit.,False
792,in previous years full-time equivalent figures used.,False
793,from year volunteeringdata (%) includesbritish landsproperty managementarm.,False
794,"these employees employed bybroadgate estates ltd, functionbrought in-house may 2018.",False
795,british landvolunteer absolute figures(total headcount): 2022: 146 2021:137 2020:191 volunteering(%)covers participation volunteering programmeand broader support community organisations causes.,False
796,"this undertaken work hours, expert volunteering detailed percentage based average headcount quarters reporting period.",False
797,"expertvolunteering(%) (previously referred skills-based volunteering) input thatuses professional specialist skills, personal talents experience tosupport non-profit organisations small, local businesses.",False
798,"this includes charity trustees, school governors,mentoring non-profit organisations expert support strategic issues specific projects.",False
799,in line withb4siguidance data includes employees undertakeexpertvolunteering solely outside paid working hours itis directly linked withour community investment programme.,False
800,expert volunteering include support industry bodies chambers commerce.,False
801,"this includes: affordable housing: constructing affordable housing, including design fees.",False
802,"public space environment: environmental art enhancements clear community benefit, regardless land ownership.",False
803,"accessibility transport: contributions highways, roads public spaces outside ownership boundary, including payments local authorities.",False
804,social welfare community facilities: construction community facilities general support community groups captured community investment programme.,False
805,"community consultation: consultation development applications, including consultants fees attendance events excluding pr fees.",False
806,"expenses: sundry expenses relating above, excluding legal fees council expenses.",False
807,figures based spend financial year.,False
808,"for affordable housing construction community facilities, costs wider construction budget; data estimated cost consultants based professional knowledge project understanding, pro-rated monthly construction period.",False
809,previous years contributions funded 22 affordable dwellings completed fy21 regents place.,False
810,scope covers sites construction year.,False
811,overview responsible business considerate constructors fig.,False
812,"from january 2022 following changes implemented: the code considerate practice changed 5 3 principles scoring changed 45, 5 points available innovation.",False
813,see target score projects remains 40.,False
814,procurement fig.,False
815,"in 2021 hours worked included reporting, furloughed hours excluded.",False
816,"spend data cumulative active developments, covering entire project spend.",False
817,spend site borough: expenditure suppliers providing service british land development permanent business premises postcode borough british land development.,False
818,this defined organisation postcode defined s106 agreement equivalent boundary set british land s106 place.,False
819,local branches national firms included defined area.,False
820,"spend smes: expenditure suppliers micro, small medium sized enterprises (smes).",False
821,this defined organisation employing fewer 250 people.,False
822,fig.,False
823,"we report payment 30 days 30 days date invoice, average time taken pay invoices.",False
824,"the data excludes invoices paid third-party landlords properties previously managed broadgate estates, following sale third-party property management portfolio.",False
825,corporate data normalised exclude disputes intergroup transactions.,False
826,health safety figs.,False
827,"british land, managing agents development project managers required report fatalities specified injuries occur (including employees, contractors visitors) common parts vacant space multi-let properties health safety executive (hse) relevant local authority.",False
828,"this requirement set reporting injuries, diseases dangerous occurrences regulations 2013 (riddor), amended 1995 2012 regulations.",False
829,"according riddor reporting guidance, accident separate, identifiable, unintended incident, causes physical injury.",False
830,this specifically includes acts non-consensual violence people work.,False
831,"fatalitiesof workers non-workersmust reported arise work-related accident, including act physical violence arenot reportable.",False
832,"thefollowing reported asriddorincidents british lands health safety reporting: a specified injury defined as: fractures, fingers, thumbs toes.",False
833,amputations.,False
834,any injury likely lead permanent loss sight reduction sight.,False
835,any crush injury head torso causing damage brain internal organs.,False
836,"serious burns (including scalding), cover 10% body/causes significant damage eyes, respiratory vital organs.",False
837,any scalping requiring hospital treatment.,False
838,any loss consciousness caused head injury asphyxia.,False
839,any injury arising working enclosed space leads hypothermia heat-induced illness/requires resuscitation admittance hospital 24 hours.,False
840,overview accidents result unable work seven days.,False
841,accidents members public (visitors) resulted injury person taken directly hospital treatment.,False
842,reporting ill health required caused worse persons work activity.,False
843,"a dangerousoccurenceis riddor reportable refers certain near-miss events including incidents involving lifting equipment, pressure systems, electrical incidents causing explosion fire, collapse scaffolding.",False
844,figs.,False
845,"for multi-let properties, health safety reporting scope includes common parts vacant space british land responsibility manage.",False
846,"for group offices, health safety reporting scope includes demised areas british land management responsibility.",False
847,"reportable incidents grouped year, based date occurred.",False
848,fig.,False
849,"thie includes incidents involving british land employees, members public, occupier employees contractors.",False
850,"group offices health safety incidents reported british land, occurring demises occupied employees.",False
851,"this covers accidents permanent employees, contractors visitors.",False
852,"injury incidence rates (riddor) referred accident frequency rates (afrs) calculated follows: offices total reportable accidents period divided total people working office building period x 100,000.",False
853,data total people working office building calculated average fte period.,False
854,occupiers provided data email differences reporting methodologies; accept 10% variance reported fte data.,False
855,"retail total reportable accidents period divided total footfall period x 100,000.",False
856,"group offices total reportable accidents period divided total number british land employees period x 100,000.",False
857,does include dangerous occurrences.,False
858,"injury frequency rate calculated total reportable accidents period divided total time worked british land employees period 100,000 hours worked.",False
859,rates calculated number incidents involving british land employees only.,False
860,fig.,False
861,"injury frequency rate refers number riddor reportable incidents (this calculated combined total fatalities, specified injuries seven-day absent incident totals) 100,000 hours worked (that is, riddor reportable injuries x 100,000/number hours worked).",False
862,number hours worked data estimated developments digital security record hours: (average number personnel day) x (hours worked) x (days worked month).,False
863,fig.,False
864,"within system, objectives managed portfolio, group offices developments.",False
865,incidents non-compliance number hse prohibition notices improvement notices served.,False
866,"managed portfolio group offices for managed portfolio sites group offices, key metrics monitor health safety management are: risks controlled annual audit: risks identified classified.",False
867,we target management agents ensure 90% risks deemed control annual assessment.,False
868,uncontrolled risks resolved: monitor time takes managing agents complete actions required convert risk requires action control.,False
869,statutory document compliance: require documents required statute british lands standards available site valid.,False
870,this includes lift inspection reports legionella risk assessments.,False
871,"where new property acquired british land management responsibility, risk assessment audit undertaken weeks.",False
872,this risk assessment based hses five steps approach adopts scoring methodology pas 79 guidance issued bsi.,False
873,developments incidents non-compliance number hse prohibition notices improvement notices served.,False
874,it includes lost days work-related accidents.,False
875,"the absentee rate calculated total days lost, relative total number days scheduled worked employees.",False
876,lost day rate specifically covers lost days work-related accidents diseases.,False
877,"lost day rate calculated total lost days riddor reportable injuries occupational diseases 100,000 hours worked (that is, lost days x 100,000/number hours worked).",False
878,"all lost days calculated moment employee leaves work (half day, example) arrive work.",False
879,overview group employment figs.,False
880,"includes maternity paternity leave, long-term sick leave sabbatical.",False
881,"unless stated, data excludes internships, temporary employees, contractors consultants.",False
882,employment type defined shown table 10 stated.,False
883,table 10: employment levels employment type executive directors senior management middle management non-management employees british land group permanent fixed term employees british land board directors.,False
884,where applicable includes non-executive directors.,False
885,"executive committee level i, levels ii iii employees british land leadership team.",False
886,"all employees, excluding executive directors senior management.",False
887,all permanent fixed term employees.,False
888,fig.,False
889,new hires includes permanent ftcs joined year left year.,False
890,non-executive directors included table reflect new joiners board year.,False
891,fig.,False
892,employees left tupe end agreed fixed term employment contract excluded.,False
893,turnover rates based number leavers divided total number number employees end year (as reported fig.,False
894,"proportion leavers gender, employment level age based number leavers category divided total number leavers year.",False
895,non-executive directors included table reflect leavers board year.,False
896,"figures include salary, discretionary performance bonuses, car allowance, board fees private medical insurance.",False
897,remuneration related share schemes included.,False
898,"the bonus element based prior year bonus paid, current year bonuses paid 31 march 2022 determined data compiled.",False
899,salary bonus payment data time employees pro-rated fte data.,False
900,"non-executive directors included table, executive directors employed permanently british land included.",False
901,fig.,False
902,full details previous years gender pay gap reporting we reporting 2022 pay gap ahead 2023 deadline set government.,False
