,corpus,have_transition_plan
421,data accurate complete practical feasible.,False
422,consistent boundaries methodologies possible allow comparisons time.,False
423,"assumptions, estimates exclusions stated explained.",False
424,we aim ensure data accurate comparable years possible.,False
425,"where updated new data available, restate data prior years restatement material.",False
426,details restatements provided relevant sections reporting criteria.,False
427,rounding mean columns sum precisely.,False
428,"we designed, implemented maintained internal controls processes information relevant measurement preparation assured data, best knowledge free material misstatement, fraud error.",False
429,"where data report assured, explicitly stated.",False
430,assets management assets owned managed british land including 100% joint ventures funds.,False
431,managed portfolio multi-let properties operational management influence control day-to-day operation facilities utilities.,False
432,"group offices floors areas occupied british land, including property management offices.",False
433,"in may 2018, brought wholly-owned property management subsidiary, broadgate estates, in-house, selling third-party property management portfolio savills.",False
434,"broadgate estates data included british land group data, stated otherwise.",False
435,we report data day-to-day operational management influence (our managed portfolio).,False
436,this includes assets 100% owned british land stake joint venture investment fund.,False
437,"as 31 march 2022, managed portfolio comprises 84% assets management.",False
438,performance overview sustainability reporting covid-19 the continually evolving circumstances caused covid-19 pandemic presented rapidly changing near term operating environment business navigate.,False
439,covid-19 significant impact number reporting areas 2021 2022 creating anomalous years.,False
440,"those areas impacted greenhouse gas emissions, energy use, water use, waste management, health safety community investment.",False
441,"for scope methodology indicator, refer relevant focus area section reporting criteria.",False
442,residential3 total 2022 48 59 9 116 number assets 2020 45 56 10 111 2021 54 50 10 114 1.,False
443,includes industrial leisure assets.,False
444,residential units belonging estate reported jointly.,False
445,table 2: our developments in planning/design committed/in construction/completed non-managed total 2022 36 0 36 number projects 2020 9 2021 37 0 37 34 0 43 1.,False
446,"scope changed fy21 reporting include projects formally committed line financial reporting, previous years reported projects 5m achieved planning.",False
447,"overview exceptions sustainability ratings, flood risk greenhouse gases, report 100% assets management.",False
448,"we report managed portfolio data portfolio type: offices, retail residential.",False
449,"for index intensity ratios, categorise retail assets shopping centres, retail parks, shopping villages high street retail.",False
450,"we report committed developments, developments construction developments completed financial year, stated.",False
451,we pro-rate information joint venture developments.,False
452,"we report developments data construction value: small (300,000 5 million) major (over 5 million).",False
453,multiple small developments contractor reported small.,False
454,"developments construction value 300,000 reported.",False
455,all 2022 data report covers financial year 1 april 2021 31 march 2022.,False
456,"most data tables report number assets reporting, total number assets, data applicable.",False
457,"data properties acquired, sold operating influence reported date purchase/ management date sale/management handover.",False
458,"we aim capture relevant data, but, feasible, estimate data pro-rate available data practical.",False
459,"where estimate, clear reporting criteria.",False
460,"since 2015, developments managed portfolio uk.",False
461,"to enable clearer comparison performance time, report like-for-like performance line guidelines european public real estate association (epra) assets portfolio years.",False
462,assets scope reported data excluded like-for-like comparison.,False
463,"as pathway net zero, monitor energy carbon intensity 2019 baseline assess progress 2030 energy net zero carbon intensity targets.",False
464,these targets based improvements building intensity.,False
465,"currently, robust building energy water data available offices.",False
466,at retail data covers landlord managed common parts include complete retail occupier consumption.,False
467,residential assets excluded scope.,False
468,"each property classified reported asset type: offices, retail parks, shopping centres (enclosed), shopping villages (unenclosed) high street retail.",False
469,scope 1 2 ghg emissions intensities epra reporting reported fig.,False
470,"for financial ratio, ghg emissions scope 1 2 financial intensity measures.",False
471,"properties included intensity calculations robust denominator data (floor area, footfall car park spaces) resource use data (energy water).",False
472,floor area car park spaces vary slightly year year refurbishment redevelopment work.,False
473,the scope net zero related energy carbon intensity reporting accordance guidelines published uk green building council.,False
474,"it includes electricity, natural gas on-site generator fuel.",False
475,"carbon intensity includes scope 1, 2 3 ghg emissions related energy sources plus emissions building sources waste disposal management water consumption.",False
476,energy intensity calculated kwh equivalent.,False
477,for offices: any new developments acquisitions new developments reached practical completion managed british land 18 months reached 80% occupancy.,False
478,any new acquisitions fully operational properties reached 80% occupancy.,False
479,"energy, carbon water relate building including landlord occupier areas plus vacant space.",False
480,floor areas relate net lettable areas (nla).,False
481,in 2021 floor area figures sourced mid-year valuations.,False
482,"for water intensity, occupier fte (full time equivalent) denominator.",False
483,estate areas (public realm) offices landlord managed supplies excluded intensity calculations.,False
484,for retail: any new developments acquisitions new developments reached practical completion managed british land 12 months reached 80% occupancy.,False
485,any new acquisitions fully operational properties reached 80% occupancy.,False
486,shopping centres: landlord common parts intensity reported occupier data obtained.,False
487,common parts floor area denominator energy carbon footfall water.,False
488,data relating vacant space excluded.,False
489,footfall estimated royal victoria place 2020.,False
490,retail parks: landlord common parts intensity reported occupier data obtained.,False
491,car park spaces denominator energy carbon footfall water.,False
492,data relating vacant space excluded.,False
493,one asset excluded intensity calculations based minimis rule: belcon industrial estate.,False
494,it negligible landlord procured common parts consumption appropriate denominator.,False
495,"footfall estimated champneys, newport harlech, st peters studlands retail parks 2021 champneys, newport harlech, st peters retail parks 2022.",False
496,"de mandeville blackwater retail parks, acquired fy22, included estimation calculation footfall data, measured estimated, unavailable.",False
497,"riverside, deepdale, a1 retail park, beaumont excluded fy22 incomplete data.",False
498,shopping villages high street retail: energy carbon intensity reported data available.,False
499,shopping villages external walkways common areas car parks enclosed.,False
500,neither common parts floor area car park spaces appropriate denominator absence occupier data.,False
501,water intensity reported shopping villages footfall denominator.,False
502,high street retail contain negligible landlord managed energy water consumption.,False
503,"these categories include following properties: shopping villages old market shopping centre, hereford whiteley shopping, fareham ealing 10-40 the broadway southgate shopping centre, bath high street retail 186 fulham road, london plymouth retail, new george street blocks 1 5 woolwich estate 2023 water target: we report progress 5% absolute improvement target total water consumption versus 2020 baseline like-for-like assets.",False
504,this encompasses retail office properties excludes residential.,False
505,properties managed portfolio 2020.,False
506,other intensity measures: group occupied floors relates nla occupied british land.,False
507,scope 1 2 ghg emissions financial intensity measures: we publish financial scope 1 2 ghg emissions intensity annual report accounts 2022.,False
508,financial intensity ratio expresses absolute scope 1 2 ghg emissions relation gross rental income properties managed portfolio.,False
509,"absolute scope 1 2 ghg emissions relate managed portfolio electricity, gas use refrigerant loss air conditioning, fuel use british land owned vehicles.",False
510,"overview gross rental income (gri) managed portfolio comprises group gri 2022 345 million (2021: 382 million), plus 100% gri generated joint ventures funds 2022 361 million (2021: 299 million), gri generated assets outside managed portfolio 2022 50 million (2021: 117 million).",False
511,figs.,False
512,refrigerant loss air conditioning units.,False
513,waste managed british land.,False
514,developments:major developments completed year.,False
515,"includes 100% ghg emissions developments, joint venture developments developments undertaken funding.",False
516,corporate:electricity floors areas occupied british land.,False
517,fuel use british land employee business travel.,False
518,"estimated based floor space, property type average electricity fuel consumption provided chartered institution building services engineers (cibse).",False
519,value chain: details value chain reporting reporting criteria fig.,False
520,a corporate accounting reporting standard revised edition uk government conversion factors company reporting 2021.,False
521,"ghg conversion emissions factors 2022 (see table 4) sourced uk department business, energy & industrial strategys (beis) 2021 guidelines.",False
522,"similarly, conversion factors 2021 2020 sourced beiss 2020 2019 guidelines.",False
523,the global warming potential greenhouse gas sourced ipcc fourth assessment report (ar4 100 year).,False
524,the greenhouse gas emissions reported tonnes carbon dioxide equivalent (co2e).,False
525,"this includes seven main ghg emissions covered kyoto greenhouse gas protocols, line common practice: carbon dioxide (co2), methane (ch4), hydrofluorocarbons (hfcs), nitrous oxide (n2o), perfluorocarbons (pfcs), sulphur hexafluoride (sf6) nitrogen trifluoride (nf3).",False
526,"emissions grouped scope 1, 2 3 accordance ghg protocol, follows: scope 1: combustion fuels, refrigerant loss.",False
527,scope 2: electricity use.,False
528,"scope 3: gas, oil, electricity transmission losses life-cycle emissions, water use, waste disposal (including emissions hazardous waste 2019), retail visitors office commuters travel, british land employee commuting homeworking, third-party procured energy non-managed assets business travel.",False
529,fig.,False
530,scope 1 2 absolute target: science based target initiative (sbti) target reported calculating absolute percentage reduction reporting years absolute location-based scope 1 2 ghg emissions versus baseline year 2020.,False
531,the reporting years total scope 1 2 ghg emissions prepared sourced figure 4.,False
532,"scope 3 intensity target: numerator intensity target annual sum (i) pro-rated embodied carbon new developments refurbishments (rics a1-a5 emissions), (ii) annual operational embodied carbon assets managed portfolio (rics b1-b5 emissions), (iii) occupier operational energy consumption assets managed portfolio (rics b6 emissions).",False
533,"a1-a5 emissions (embodied carbon construction stages new developments refurbishments carbon levy applies): includes ghg emissions new developments refurbishments, carbon levy applies, completed 2020 construction (stage 5).",False
534,"whole life carbon assessment built environment 1st edition, november, 2017.",False
535,actual/as built carbon intensity measured construction phase practical completion recalculation performed assess report remaining carbon emissions stage 4 final/as built assessment practical completion.,False
536,"for sbti numerator, a1-a5 emissions pro-rated duration construction project.",False
537,"at end construction, projects actual embodied carbon higher lower estimate, final years pro-rating adjusted account this.",False
538,"for example, four-year project estimated result 10,000 tonnes co2e claim 2,500 tonnes co2e year projects life.",False
539,"if actual project results 9,000 tonnes co2e, final years pro-rating reduced 2,500 1,500 tonnes co2e.",False
540,"b1-b5 emissions (embodied carbon operations managed assets): currently, ghg emissions estimated industry benchmarks developed industry expert simon sturgis (see table below).",False
541,"in future, british land intends monitor actual operational embodied emissions managed assets.",False
542,"offices shopping centres: nla inflated 25% approximate gia, line gresb common parts ratios (20-30% common parts).",False
543,"the denominator intensity target sum (i) net lettable area managed portfolio, (ii) pro-rated net lettable area developments construction completed reporting year.",False
544,overview net zero carbon developments fig.,False
545,"nzc2020standard:from april 2020, ourapproach includesthe minimisation embodied carbon intensity offsetting residual embodied carbon.",False
546,"nzc 2030 standard:as werolloutthefull2030 programme, british land incorporate theadditional criteriaof advanced modelling operational efficiency (through nabers uk),theminimisationof on-site fossil fuel combustion,theuse on-siterenewables renewable power newly installed(additional)sources.",False
547,"all new developments refurbishments, carbon levy applies, subject carbon levy required report embodied emissions offset zero practical completion.",False
548,embodied carbon calculated performing life carbon assessments aligned rics guidance whole life carbon assessment built environment 1st edition november 2017 breeam compliant life carbon software oneclick etool).,False
549,a emissions offset following practical completion.,False
550,"embodied carbon intensity: estimated (during development) final (following practical completion) embodied emissions rics stage a, reported kilogrammes co2e square meter gross internal area, excluding biogenic carbon.",False
551,"landlord operational efficiency/whole building operational efficiency (modelled): modelled operational energy efficiency development, reported kilowatt-hour equivalent net lettable area (in square metres) modelled enhanced building energy modelling (ebem) nabers design performance.",False
552,this modelling currently available offices only.,False
553,forecasted nabers energy star rating: indicates completed: refer projects achieved practical completion.,False
554,committed: refers development projects formal commitment progress development relevant pre-conditions met.,False
555,near term: refers projects start 12 months significant uncertainty intention commence development.,False
556,medium term: intention undertake development internal certain conditions satisfied (for example relating lease expiries planning).,False
557,"zero on-site fossil fuel combustion: indicates development use renewable bio-gas, green hydrogen, all-electric heating.",False
558,on-site additional ppa renewables: indicates forecasted operational energy provided on-site renewable energy generation and/or project-specific renewable energy power purchase agreements.,False
559,forecasted operational emissions subject carbon tax: indicates development project subject local government carbon taxes.,False
560,"an example greater london authority, policy requires developments achieve mayors carbon reduction targets, developer expected shortfall (residual emissions) off-site cash-in-lieu contribution local boroughs carbon offsetting fund.",False
561,this offsetting fund revenue-raising tax earmarked funding emissions reductions activities.,False
562,committed projects: refer projects approved executive board progress construction stage.,False
563,completed projects: refer projects achieved practical completion.,False
564,fig.,False
565,"all new developments refurbishments, carbon levy applies, required report embodied emissions offset zero practical completion.",False
566,embodied carbon calculated performing life carbon assessments aligned rics guidance whole life carbon assessment built environment 1st edition november 2017 breeam compliant life carbon software oneclick etool) excludes biogenic carbon.,False
567,rics assessments produced riba stage 2 updated stage reflect changes design inclusion low carbon materials.,False
568,overview greenhouse gas emissions fig.,False
569,"scope 2 emissions: managed portfolio electricity use common parts shared services corporate electricity use, reported fig.",False
570,"for 2019 2021, reported scope 2 emissions according location-based market-based method.",False
571,we use location-based method report total ghg emissions track performance 2019 baseline.,False
572,the location-based method ghg emissions reported previous years.,False
573,the location-based method reflects average emissions intensity grid.,False
574,we use beis uk grid average emissions factor location-based method (electricity generated scope 2 direct).,False
575,the market-based method reflects emissions electricity purchase.,False
576,we use supplier specific emission rates available residual mix emissions factor remaining supplies (see table 5).,False
577,"in 2022, 93% purchased electricity backed renewable energy guarantees origin (regos).",False
578,this based electricity contracts report energy suppliers assurance provider.,False
579,the regos retired annually june.,False
580,"in 2022, 85% purchased fuel backed renewable gas guarantees origin (rggos).",False
581,this based gas contracts report energy suppliers assurance provider.,False
582,"from 2020, market-based emissions office occupiers reported scope 3 market based.",False
583,managed portfolio occupier procured: energy consumption let space retail assets.,False
584,"in 2021 2020 estimated retail electricity fuel use based floor space, property type average electricity consumption provided chartered institution building services engineers (cibse).",False
585,we intend include reporting occupier procured water future years.,False
586,"estimated based floor space, property type average electricity fuel consumption provided chartered institution building services engineers (cibse).",False
587,"whole life emissions new builds major developments: upstream emissions rics product construction process stages (a1-a5), aligned rics whole life carbon assessment built environment (1st edition, nov 2017).",False
588,figures represent projects reached practical completion reporting year.,False
589,"whole life emissions new builds acquired: above, emissions rics modules a1-a5 acquisitions completed reporting year.",False
590,"in 2020/21, new builds acquired.",False
591,value chain employee commuting: emissions british land staff commuting.,False
592,estimated previous emissions estimates arup beacon tool 2016 pro-rating changes employee fte.,False
593,employee commuting reported fy21 small proportion employees commuted small year.,False
594,employee commuting calculated cover 7 months fy22 working home required.,False
595,value chain employee homeworking: estimated emissions homeworking reported fy21 fy22 employees worked british land office short period.,False
596,employee homeworking data calculated cover 5 months fy22 working home required.,False
597,value chain business travel: air travel: emissions staff business travel air.,False
598,"calculated (i) origin-destination codes travel class provided british lands travel management companies, (ii) great-circle distances great circle mapper ( ).",False
599,air travel emissions based emission factors domestic average passenger.,False
600,rail travel: emissions staff business travel rail.,False
601,"where available, calculated kilometres travelled travel class provided british lands travel management companies.",False
602,"where kilometres unavailable, estimated british lands average kilometres travelled gbp spent.",False
603,emissions tube travel excluded.,False
604,"car mileage: emissions staff travel car, excluding taxis.",False
605,this calculated exact claimed mileage expenses.,False
606,value chain retail visitor travel: emissions visitor travel retail assets.,False
607,"estimated based annual footfall, third-party surveys visitors mode duration travel.",False
608,overview value chain office occupier employee commuting emissions commute employees occupiers office assets.,False
609,estimated based surveys office campus workers mode transport distance travelled.,False
610,"in 2020, british land re-instituted collection water consumption data retail assets.",False
611,"in 2019, water use partially reported retail sites water data incomplete included fig.",False
612,"from 2019, scope 3 emissions include emissions hazardous waste disposal.",False
613,"developments: the scope limited major developments completed year, excluding fitouts public realm projects.",False
614,assessed accordancewithrics methodology guidance reported excluding biogenic carbon accordance final project assessment practical completion.,False
615,fig.,False
616,like-for-like scope 2 emissions reported according location-based method.,False
617,fig.,False
618,fig.,False
619,table 4 shows combined carbon-equivalent emission factors different ghgs considered.,False
620,petrol scope 3 (kg co2e/litre) lpg scope 1 (kg co2e/litre) lpg scope 3 (kg co2e/litre) uk 0.,False
621,overview fig 9.,False
622,internal carbon levy transition vehicle data table reported cumulative basis.,False
623,"from 01 april 2020, british land applied internal carbon levy 60 tonne co2e embodied carbon developments.",False
624,"this mechanism involves: offsetting from fy21, tonne embodied carbon produced new developments, british land earmark 20/tonne levy purchase carbon offset credits.",False
625,completed assets refers development projects completed subsequently entered british lands managed portfolio property assets.,False
626,"completed assets fy21 100 liverpool street st annes, 100 liverpool street offset fy21.",False
627,"st annes offset fy22, wider 1 triton square development project.",False
628,committed developments refer development projects formal commitment progress development relevant pre-conditions met.,False
629,"at close fy21, committed developments norton folgate, 1 broadgate 1 triton square.",False
630,for assets british land 100% asset figures adjusted reflected equity share.,False
631,british lands 50% offset matched jv partner ensure 100% offset embodied carbon.,False
632,"the remaining 40/tonne generated internal carbon levy result new developments directed transition vehicle, adjusted reflect british land equity share relevant.",False
633,the transition vehicle internal source funding retrofitting projects deliver improvements energy efficiency energy sourcing standing portfolio.,False
634,"float additionally, year fy21 british land invest 5m transition vehicle.",False
635,investment retrofitting investment energy/emissions saving initiatives standing assets.,False
636,repayment funding savings result energy/ emissions saving initiatives repaid transition vehicle costs met.,False
637,these funds invested retrofitting projects.,False
638,annual savings retrofitting: carbon savings greenhouse gas emissions savings calculations based direct energy savings initiative related upstream (scope 3) emissions savings.,False
639,energy savings power savings (kw) x total burning hours (adjusted occupancy change).,False
640,cost savings energy savings (kwh) x energy unit costs + savings associated reduced maintenance needs.,False
641,"for residential consists clarges mayfair high end residential the triton building, regents place landlord consumption minimis.",False
642,"where asset energy data partially unavailable, data adjacent periods estimate data missing periods.",False
643,"at retail properties, meters serve common parts occupier areas, sub-meter readings deducted meter total provide common parts consumption.",False
644,"where possible, split common parts occupier consumption estimated.",False
645,"where estimate available, mixed meters reported common parts.",False
646,"at majority managed offices, common parts, shared services occupier direct use sub-metered.",False
647,"where sub-metering available, split common parts, shared services occupier consumption estimated.",False
648,energy use relating vacant space vacant units included common parts.,False
649,energy use major development works assets deducted total consumption.,False
650,oil use measured possible.,False
651,"otherwise, estimated based methods reflect equipment for.",False
652,see table 4 fuel oil conversion factors.,False
653,"on-site renewables offices comprise photovoltaic panels offices: 1 triton square, 100 liverpool street, 6 orsman road, 10 portman square 20 triton street.",False
654,this energy site included common parts data.,False
655,"low carbon technologies offices include combined heat power (chp) plant 10 brock street, air source heat pump 350 euston road ground source heat pump 10 portman square.",False
656,the heat power output chp reported fig.,False
