,corpus,have_transition_plan
207,"as developing confidence skills candidates face barriers employment, capital city partnership site day, retailers know vulnerable candidates network resources draw on.",False
208,"as focus providing affordable retail space ealing broadway worked opportunity curated collective, family business supports independent artists makers.",False
209,the team identified unit good location supportive terms.,False
210,curative collective able use pre-existing shop fit avoid extra costs.,False
211,"i thank andrew, ealing broadway team british land getting placemaking initiative supportive.",False
212,weve able work 25 local creative partners.,False
213,people ealing love able interact people items buying.,False
214,weve gone market stall thinking year leases support british land.,False
215,overview responsible business responsible business we advocate responsible business practices british land supply chain.,False
216,"our key areas focus responsible employment, diversity, equality & inclusion responsible procurement.",False
217,our people competitive advantage.,False
218,we invest seek create environment achieve potential.,False
219,we apply approach supply chain.,False
220,overview responsible business responsible business we advocate responsible business practices british land supply chain.,False
221,our key areas focus set here.,False
222,responsible employment invest people we recognise importance growing talent internally.,False
223,"this year, invested 440,000 training qualifications people (380,000 fy21), developing leadership talent business.",False
224,"employees completed 7,000 hours training supporting 14 colleagues gain professional qualifications.",False
225,"to support career development run internal mentorship scheme, includes senior leaders partner circl coaching, pairing people local students, growing coaching culture supporting local talent.",False
226,"connect people we ran in-depth employee engagement survey early 2022, completed 87% people.",False
227,"topics included leadership, engagement, learning development, social connection wellbeing, diversity equality & inclusion (de&i), response covid.",False
228,our overall engagement score 69%.,False
229,some positive messages emerged 90% staff reporting proud work british land 85% confirming recommend british land great place work.,False
230,the survey highlighted areas improvement ambition increase overall engagement score.,False
231,"to this, leadership teams having detailed sessions departments working collaboratively teams create action plan addressing key points raised.",False
232,provide safe working environment we maintained excellent standards health safety ensure people places safe.,False
233,our health safety management accredited international iso standard accident frequency rates remain substantially national average.,False
234,"families need flexibility, opportunities equal.",False
235,thats british land offers months shared parental leave pay.,False
236,"they support employees live lives careers ways work us, reflecting modern lifestyles benefits.",False
237,"michael olivia head planning (michael), team assistant (olivia) diversity, equality & inclusion in early 2022 launched diversity, equality & inclusion strategy, approved csr committee.",False
238,"aligned united nations sustainable development goals, sets commitments improve diversity, equality inclusivity business 2030, ensuring reflect understand people work, shop, live spend time places.",False
239,"all employee feedback channels, including exit interviews engagement surveys, include diversity demographics help understand employees different backgrounds, ethnicities experiences encounter challenges, improve.",False
240,"to attract diverse workforce, ensure hiring managers complete anti-bias training receive blind cvs selection interview stage removed ethnicity gender indicators.",False
241,we work agencies bame recruitment london works reach candidates varied backgrounds.,False
242,"we taken lead role 10,000 black interns initiative, real estate sector chair, continue support change 100 programme, offering paid internships university students recent graduates disabilities long-term conditions.",False
243,"our employee-led networks continue drive progress diversity, equality inclusion.",False
244,"these include ability network enable, reach (race ethnicity celebrating heritage), parents & carers, pride womens network, recently rebranded equitable.",False
245,"overview responsible business nextgen, represent support generation property professionals.",False
246,"improve gender diversity levels in 2022, exceeded commitment maintain minimum 35% female representation board, 36% women board 37% senior management female.",False
247,"improve ethnic diversity levels we fulfilled commitment maintain minimum directors ethnic minority background, ahead parker review recommendations ethnic diversity board level.",False
248,this reduction ahead target reduce pay gap 2% year year.,False
249,responsible procurement a strong relationship suppliers plays key role successful delivery strategy governed supplier code conduct.,False
250,"this sets clear social, ethical environmental obligations supply chain promotes safe fair working conditions.",False
251,compliance mandatory suppliers.,False
252,we pay real living wage british land employees strongly encourage suppliers pay uk employees real living wage.,False
253,our london campuses accredited living wage places comply mayors good work standard.,False
254,our slavery human trafficking statement website governance/modern-slavery-act mandating prompt payment paying suppliers partners promptly agreed payment terms ethical responsibility economically beneficial parties wider economy.,False
255,we signatory uk governments prompt payment code 2010 aim pay 95% suppliers 30 days.,False
256,group invoices settled 18 days average.,False
257,"responsible procurement standards this year, introduced contractor framework, identifying key sustainability performance indicators monitor new contractors employed asset management initiatives.",False
258,we launched supplier excellence awards celebrate showcase best suppliers contributions range categories including responsible business.,False
259,active modern slavery we uphold human rights employees supply chain.,False
260,"this year, provided anti-modern slavery training employees.",False
261,"through partnership anti-modern slavery charity unseen, undertook independent audits 10 suppliers operating higher risk areas (with 11 scheduled), reviewing compliance 12 key areas supplier code conduct.",False
262,"these included human rights, health safety, equal opportunities, fair reward, working hours, staff development worker representation.",False
263,"informed risk impact assessments, audits prioritised property management service providers assets construction contractors developments.",False
264,all suppliers scored 77% working suppliers improvement opportunities identified agreed.,False
265,"we continue member unseens business helpline portal, allows people report potential modern slavery occurrence anonymously.",False
266,our supplier excellence awards we delighted recognised british land supplier awards felt rewarding recognised clients way.,False
267,i confirm having fm industry 12 years i havent seen client approach service partner recognition trailblazing springs mind.,False
268,overview british land sustainability accounts 2022 net zero carbon carbon emissions fig.,False
269,please pages 85-87 assurance reports korn ferry (paygap data)and dnv.,False
270,"sbti, net zero targets greenhouse gas intensity for second consecutive year, covid-19 related government restrictions significantly affected portfolios carbon intensity, representing majority reduction.",False
271,"however, delivered initiatives enhance energy efficiency year, notably exchange house (see p6).",False
272,overview carbon emissions (continued) fig.,False
273,the embodied emissions offset project achieves practical completion.,False
274,"until uk government specifies long-term strategy low-carbon heating (including role hydrogen all-electric buildings), y include use renewable bio-gas.",False
275,office a1 units electric.,False
276,exploring electric option targeting <80.,False
277,n/a project undertaken nabers accreditation.,False
278,tbc data available future years projects progress fig.,False
279,overview carbon emissions (continued) fig.,False
280,overview carbon emissions (continued) fig.,False
281,"in 2021/22, estimated energy consumption retail units assumes regular operations.",False
282,"this significant rise vs year, assumed 50% operation retail units.",False
283,this years totals include embodied carbon 1 triton square following practical completion.,False
284,location based: our use 2021 uk greenhouse gas conversion factors reflect +3% increase ghg intensity gas (vs 2020) +1% increase ghg intensity electricity (vs 2020).,False
285,overview carbon emissions (continued) fig.,False
286,overview carbon emissions (continued) fig.,False
287,"while proportion renewable gas rose 85% year, renewable power dropped 93%.",False
288,this reduced year primarily impact onboarding new assets time transfer assets renewable tariff.,False
289,overview carbon emissions (continued) fig.,False
290,overview carbon emissions (continued) fig.,False
291,"retail: direct use retail units (occupier procured) fri non-landlord obtained energy non-bl managed assets upstream emissions landlord obtained water use indirect value chain greenhouse gas emissions in 2021/22, estimated energy consumption retail units assumes regular operations.",False
292,"this significant rise vs year, assumed 50% operation retail units.",False
293,this years totals include embodied carbon 1 triton square following practical completion.,False
294,overview carbon emissions (continued) fig.,False
295,fig.,False
296,"however, delivered initiatives enhance energy efficiency year, notably exchange house (see p16).",False
297,other energy intensity measures group occupied floors kwh sqm * common parts baseline.,False
298,overview carbon emissions (continued) fig.,False
299,the committed development figures provisional amounts adjusted differ completed values.,False
300,these figures proportionally disclosed share.,False
301,this figure excludes funds allocated offsets funds invested projects improve energy efficiency.,False
302,"investment year included chiller replacement broadwalk house total capex 552,000.",False
303,"this expected deliver annual cost savings 65,000 repaid service charge.",False
304,our net zero energy auditsassessed major assets representing 90% landlord procured power.,False
305,overview energy use fig.,False
306,"renewable non-renewable purchased purchased managed portfolio offices: common parts offices: shared services offices: direct use occupier space sub-total retail: common parts retail: direct use occupier space (landlord procured) residential: common parts scope (managed properties) corporate group offices overall total proportion purchased electricity renewable sources proportion total electricity renewable sources 110 110 1,150 18,635 20,283 59,974 98,891 14,351 2,584 2,958 999 3,793 7,749 547 300 570 21,703 21,282 63,766 106,751 16,047 2,883 570 109/111 49 49 1,210 20,148 16,375 66,178 102,701 14,722 2 947 821 891 279 332 1,502 196 93 1,084 21,087 16,654 66,510 104,252 16,129 1,040 1,087 108/112 821 46 46 1,274 24 22,618 17,838 83,496 123,952 18,151 1,827 143 240 3,216 3,599 661 16 984 22,808 18,078 86,712 127,598 20,086 1,843 1,008 102/106 971 971 1,260 116,535 9,166 126,960 1,261 119,192 2,875 123,328 1,344 144,901 5,259 151,504 93% 93% 98% 98% 96% 97% total electricity consumption this year, proportion renewable power dropped 93%.",False
307,this reduction year primarily impact onboarding new assets time transfer assets renewable tariff.,False
308,overview energy use (continued) fig.,False
309,managed portfolio offices: common parts offices: shared services offices: direct use occupier space sub-total retail: common parts retail: direct use occupier space (landlord procured) residential: common parts sub-total all property types: on-site vehicles fuel consumption service providers on-site vehicles equipment corporate group offices overall total proportion purchased fuel renewable sources proportion total fuel renewable sources fig.,False
310,overview energy use (continued) fig.,False
311,"managed portfolio offices: common parts offices: shared services offices: direct use occupier space sub-total retail: common parts retail: direct use occupier space residential: common parts all property types: on-site vehicles fuel consumption service providers on-site vehicles equipment all property types: district heating cooling sub-total corporate group offices overall total proportion purchased energy renewable sources proportion total energy renewable sources solar pv (including energy exported grid) chp (electricity generated) chp (heat generated) total generated proportion energy use common parts andsharedservices proportion energy use total energy consumed generated site this year, 90% landlord procured energy renewable sources.",False
312,"while proportion renewable gas rose 85% year, renewable power dropped 93%.",False
313,this reduced year primarily impact onboarding new assets time transfer assets renewable tariff.,False
314,overview environmental leadership building certifications fig.,False
315,the revolving credit facility kpis exclude residential properties.,False
316,"despite disposal breeam-rated assets recent years, overall proportion breeam certified assets continues rise.",False
317,"likewise, 10 exchange square completed assessment year, breeam in use rating very good.",False
318,"this year, piloted breeam in use (part 2) assessments number retail sites.",False
319,"as traditionally procured energy water behalf retail occupiers, understood upfront lack unit consumption data limit assessment rating pass.",False
320,"however, process served useful benchmark alignment breeams management criteria incentivises prioritise collection retailer consumption data, enable significantly improve ratings future.",False
321,overview building certifications (continued) fig.,False
322,we expect total cost retrofitting portfolio region 100m two-thirds funded service charge customers directly.,False
323,these typically low cost interventions attractive payback period support occupiers achieving sustainability ambitions.,False
324,overview water use fig.,False
325,fig.,False
326,"at retail, water consumption returned familiar levels 2021/22, following significant increase previous year leak nugent shopping park.",False
327,overview water use (continued) fig.,False
328,overview overview waste materials fig.,False
329,overview waste materials (continued) fig.,False
330,overview waste materials (continued) fig.,False
331,assurance excludes waste diverted landfill re-use site landfilled tax costs ().,False
332,fig.,False
333,"proportion sustainable sources 2020 58% 2021 88% 12% 100% 34/36 42% 100% 49/52 2022 56% 39% 95% 35/36 waste management developments during excavation works canada water projects, discovered soil contained historic land contamination, whilst classified hazardous waste, unsuitable repurposing existing ground conditions.",False
334,"the team reviewed options including cleaning soil, onsite attendance dedicated waste supplier groundworks programme test segregate soil, possible landfill site capping/topper.",False
335,"despite efforts, sizable proportion sent landfill.",False
336,"sustainable timber at refurbishment exchange house, existing raised access floors poor condition; instead replacing brand new floors, opted install reclaimed tiles supplier takes raised floor tiles, tests provides new warranties.",False
337,"whilst originally fsc certified, flooring supplier purchased hold fsc certification, breaking chain custody certification.",False
338,chain custody important choosing report non-certified.,False
339,"installing reclaimed tiles keeps good quality materials circulation, saves virgin materials carbon emissions.",False
340,overview waste materials (continued) fig.,False
341,the non-compliance incident reported happened broadgate campus excavator strike occurred gas pipe utility diversion works 1 broadgate.,False
342,"as precautionary measure, surrounding area evacuated london fire brigade, assisted onsite team campus staff, established gas dispersed pose risk neighbouring buildings.",False
343,"the pipe quickly repaired cadent changes method statements implemented contractor, following review lessons learnt.",False
344,overview biodiversity fig.,False
345,fig.,False
346,overview community fig.,False
347,fig.,False
348,"we work partnership customers, suppliers local partners develop skills local people empower access opportunities places supply chain.",False
349,"initiatives include pre-employment training, virtual programmes, mentoring, work placements, graduate schemes, internships, apprenticeships job fairs.",False
350,overview contributions investment fig.,False
351,"key supplier workforce (and british land employees outside working hours) time total beneficiaries total individuals directly benefitting community investment programme 2022 1,813,909 58,833 56,720 1,929,462 635,904 159,732 795,636 direct community investment () 2020 1,619,646 313,612 238,804 2,172,062 2021 1,475,171 102,474 53,509 1,631,154 170,367 973,188 29,663 200,030 84,547 1,057,735 23,949 23,024 40,076 long term space value space provided community organisations 2,861,454 nr nr volunteering fig.",False
352,community investment for year reporting value space provide community organisations.,False
353,this value reflects cost organisations bear space provided british land.,False
354,fig.,False
355,this spend associated planning consents.,False
356,our development activity varies significantly year year figure fluctuate.,False
357,overview considerate constructors fig.,False
358,"considerate constructors scheme scoring considerate constructors scheme updated fy22, details here: fig.",False
359,"the british land company plc (company number: ) signatory prompt payment code sets standards payment practices best practice administered chartered institute credit management behalf department business, energy industrial strategy (beis).",False
360,"regulations section 3 small business, enterprise employment act 2015 (and, limited liability partnerships (llps), limited liability partnerships act 2000), introduce duty uks largest companies llps report half-yearly basis payment practices, policies performance.",False
361,overview health safety fig.,False
362,overview health safety (continued) fig.,False
363,"in system, risks classed classed substantial, requiring resolution shorter timeframe previous compliance partner.",False
364,the significant dip 2020 resolved percentages indication transition new service provider subsequent work required integrate new classifications processes.,False
365,fig.,False
366,it includes lost days work-related accidents.,False
367,"the absentee rate calculated total days lost, relative total number days scheduled worked employees.",False
368,group employment fig.,False
369,"all numbers include maternity paternity leave, long term sick leave sabbatical.",False
370,overview group employment (continued) fig.,False
371,turnover rates based number leavers divided total number employees 31 march 2022.,False
372,overview group employment (continued) fig.,False
373,this compare gender pay ratios employees employment level.,False
374,please page 83 elements remuneration.,False
375,overview group employment (continued) fig.,False
376,overview group employment (continued) fig.,False
377,overview group employment (continued) fig.,False
378,overview group employment (continued) fig.,False
379,not mandatory training.,False
380,fig.,False
381,"employee training proportion category dse assessment training (previously referred health safety training), fell significantly year alternative focus working home returning office assessments.",False
382,dse assessment mandatory year employees undertake assessments appropriate.,False
383,participation levels dse assessment training expecting return higher rate 2023.,False
384,"we launched new cyber security awareness training year; mandatory course it team target reaching 85% trained, exceeded.",False
385,"as epra best practice recommendations, total energy water data covers energy water procured british land.",False
386,energy carbon intensity data covers building offices common parts retail.,False
387,water intensity data covers buildings offices common parts retail.,False
388,per m2 comprises net internal areas offices common parts retail.,False
389,overview epra index (continued) social performance1 area health & safety epra code h&s-emp indicator gri code 403-2 employee health safety h&s-asset 416-1 asset health safety h&s-comp comty-eng community engagement 416-2 413-1 proportion managed portfolio (floor area) community activity implemented governance governance gov-board 102-22 composition highest governance body gov-select 102-23 nominating selecting highest governance body gov-col 102-25 process managing conflicts 1.,False
390,employee data restated headcount fte.,False
391,overview sasb table this british lands sustainability accounts references indicators set sustainability accounting standards board (sasb) framework.,False
392,this index highlights existing reporting aligns framework provides limited data certain indicators previously reported against.,False
393,we continue consider reporting develop meet needs stakeholders.,False
394,"area energy management units kwhe sqm sasb code if-re-130a 1 location figure 8, p36 gri code 302-1 if-re-130a 2 302-1 if-re-130a 3 302-1 if-re-130a 4 if-re-130a 5 103-2 activity metric energy consumption data coverage percentage floor area, property subsector total energy consumed portfolio area data coverage, percentage grid electricity, percentage renewable, property subsector lfl change energy consumption portfolio area data coverage, property subsector percentage eligible portfolio (1) obtained energy rating (2) certified energy star, property subsector description building energy management consideration integrated property investment analysis operational strategy mwh figure 13, p40 mwh figure 12, p39 % floor area (sqm) figure 14, p41 discussion analysis energy carbon management integrated policies procedures.",False
395,"details pathway net zero1, sustainability brief developments operations2 sustainability brief acquisitions3 figure 18, p44 by floor area, 48%4 assets management located areas high water stress.",False
396,of office assets account 51% floor area areas high water stress retail assets account 22%.,False
397,"figure 16, p43 water management if-re-140a 1 water withdrawal data coverage percentage total floor area percentage regions high extremely high baseline water stress, property sector % floor area (ft2) if-re-140a 2 if-re-140a 3 if-re-140a 4 total water withdrawn portfolio area data coverage percentage regions high extremely high baseline water stress, property subsector lfl change water withdrawn portfolio area data coverage, property subsector discussion water management risks description strategies practices mitigate risks.",False
398,in 2022 undertook number independent water audits order identify existing potential issues.,False
399,"our pathway net zero, transition plan, available online 2.",False
400,our sustainability brief developments operations available online 3.,False
401,"overview sasb table (continued) area management tenant sustainability impacts sasb code if-re-410a 1 gri code activity metric percentage new leases contain cost recovery clause resource efficiency-related capital improvements associated leased floor area, property subsector units if-re-410a 2 percentage tenants separately metered submetered (1) grid electricity consumption (2) water withdrawals, property sector % floor area (ft2) if-re-410a 3 description approach measuring, incentivizing, improving sustainability impacts tenants.",False
402,our leases include sustainability clauses cost recovery clauses.,False
403,where lifecycle replacement requires replacement plant engage tenants encourage selection efficient option.,False
404,"our service charge agreement allows like-for-lie replacement plant equipment, use transition vehicle fund gaps efficient equipment installed.",False
405,"electricity figure 10, p38 water-our sustainability brief requires tenant sub-meters water new developments.",False
406,following net zero audits programme pathway major asset.,False
407,these pathways arebeing presented occupiers.,False
408,collaboration andcontribution occupiers essential.,False
409,sustainability impacts standing agenda item property management forums.,False
410,all tenants access data.,False
411,the following section provides specific explanations data figures above.,False
412,"it sets overall principles, boundaries, scope methodologies applied reporting sustainability data 2022 annual report accounts, sustainability accounts corporate website.",False
413,"the following sets overall principles, boundaries, scope methodologies applied reporting sustainability data 2022 annual report accounts, sustainability accounts (the report) corporate website.",False
414,further explanations provided section reporting criteria.,False
415,we report data issues relevant sustainability strategy.,False
416,data reported meaningful consistent dnvs assurance report included report assurance statement section.,False
417,data included scope dnvs assurance outlined section.,False
418,this dnvs year assurance partner.,False
419,the explanatory notes.,False
420,data presented transparently aid reader making judgements decisions performance confidence report.,False
